{
  "$schema": "https://json-schema.org/draft/2020-12/schema",
  "$id": "urn:agent-evals-standard:schema:governance-resolution-ledger:1",
  "title": "Authenticated governance resolution ledger",
  "type": "object",
  "required": [
    "schemaVersion",
    "ledgerId",
    "policyInstanceHash",
    "matrixInstanceHash",
    "initialRoot",
    "currentRoot",
    "externalAnchor",
    "evidenceManifest",
    "events",
    "issuer",
    "issuedAt"
  ],
  "properties": {
    "schemaVersion": { "const": "agent-eval-governance-resolution-ledger-1" },
    "ledgerId": { "type": "string", "minLength": 1 },
    "policyInstanceHash": { "$ref": "#/$defs/digest" },
    "matrixInstanceHash": { "$ref": "#/$defs/digest" },
    "initialRoot": { "$ref": "#/$defs/digest" },
    "currentRoot": { "$ref": "#/$defs/digest" },
    "externalAnchor": { "$ref": "#/$defs/artifactRef" },
    "evidenceManifest": {
      "type": "array",
      "minItems": 1,
      "uniqueItems": true,
      "items": { "$ref": "urn:agent-evals-standard:schema:evidence-artifact:1" }
    },
    "events": {
      "type": "array",
      "items": { "$ref": "#/$defs/ledgerEvent" }
    },
    "issuer": {
      "type": "object",
      "required": ["id", "role"],
      "properties": {
        "id": { "type": "string", "minLength": 1 },
        "role": { "type": "string", "minLength": 1 }
      },
      "additionalProperties": false
    },
    "issuedAt": { "type": "string", "format": "date-time", "pattern": "Z$" }
  },
  "additionalProperties": false,
  "$defs": {
    "digest": { "type": "string", "pattern": "^sha256:[a-f0-9]{64}$" },
    "artifactRef": { "type": "string", "pattern": "^[A-Za-z0-9][A-Za-z0-9_.:-]*$" },
    "ledgerEvent": {
      "type": "object",
      "required": ["sequence", "eventId", "eventType", "payloadHash", "previousEventHash", "eventHash", "timestamp", "payload"],
      "properties": {
        "sequence": { "type": "integer", "minimum": 1 },
        "eventId": { "type": "string", "minLength": 1 },
        "eventType": { "enum": ["escalation", "enforcement_receipt", "assurance_observation", "resolution"] },
        "payloadHash": { "$ref": "#/$defs/digest" },
        "previousEventHash": {
          "oneOf": [
            { "type": "null" },
            { "$ref": "#/$defs/digest" }
          ]
        },
        "eventHash": { "$ref": "#/$defs/digest" },
        "timestamp": { "type": "string", "format": "date-time", "pattern": "Z$" },
        "payload": {
          "oneOf": [
            { "$ref": "urn:agent-evals-standard:schema:escalation-event:1" },
            { "$ref": "urn:agent-evals-standard:schema:enforcement-receipt:1" },
            { "$ref": "urn:agent-evals-standard:schema:assurance-observation:1" },
            { "$ref": "urn:agent-evals-standard:schema:governance-resolution:1" }
          ]
        }
      },
      "allOf": [
        {
          "if": { "properties": { "eventType": { "const": "escalation" } }, "required": ["eventType"] },
          "then": { "properties": { "payload": { "$ref": "urn:agent-evals-standard:schema:escalation-event:1" } } }
        },
        {
          "if": { "properties": { "eventType": { "const": "enforcement_receipt" } }, "required": ["eventType"] },
          "then": { "properties": { "payload": { "$ref": "urn:agent-evals-standard:schema:enforcement-receipt:1" } } }
        },
        {
          "if": { "properties": { "eventType": { "const": "assurance_observation" } }, "required": ["eventType"] },
          "then": { "properties": { "payload": { "$ref": "urn:agent-evals-standard:schema:assurance-observation:1" } } }
        },
        {
          "if": { "properties": { "eventType": { "const": "resolution" } }, "required": ["eventType"] },
          "then": { "properties": { "payload": { "$ref": "urn:agent-evals-standard:schema:governance-resolution:1" } } }
        }
      ],
      "additionalProperties": false
    }
  }
}
